{
  "dogs": {
    "german-shepherd": {
      "id": "german-shepherd",
      "name": "German Shepherd",
      "species": "dogs",
      "energy": "High",
      "size": "Large",
      "good_with_kids": "Good",
      "description_short": "Loyal, intelligent, and highly trainable working dog breed",
      "traits": ["Loyal", "Intelligent", "Protective"],
      "imageUrl": "https://images.unsplash.com/photo-1589941013453-ec89f33b5e95?auto=format&fit=crop&q=80",
      "seo_content": "German Shepherds are one of the most popular dog breeds worldwide, known for their intelligence, loyalty, and versatility. These remarkable dogs were originally bred as herding dogs in Germany but have since become popular as working dogs, particularly in police and military service, as well as beloved family companions.\n\nPhysical Characteristics:\nGerman Shepherds are large, muscular dogs with a distinctive appearance. They typically stand 22-26 inches tall at the shoulder and weigh between 50-90 pounds. Their double coat comes in various colors, most commonly black and tan. They have erect ears, a long muzzle, and an alert, intelligent expression.\n\nTemperament and Personality:\nThese dogs are known for their exceptional intelligence and trainability. They are loyal, confident, and courageous, making them excellent guardians and family protectors. German Shepherds form strong bonds with their families and are particularly good with children when properly socialized.\n\nTraining and Exercise:\nGerman Shepherds require consistent training and plenty of physical and mental stimulation. They excel in various dog sports, including obedience, agility, and tracking. Daily exercise is essential to prevent boredom and potential behavioral issues.\n\nHealth Considerations:\nLike many large breeds, German Shepherds can be prone to certain health issues, including hip dysplasia, elbow dysplasia, and degenerative myelopathy. Regular veterinary check-ups and maintaining a healthy weight are important for their well-being.\n\nGrooming Needs:\nTheir double coat requires regular brushing to manage shedding and maintain coat health. They typically shed heavily twice a year during seasonal changes.\n\nIdeal Living Conditions:\nGerman Shepherds adapt well to various living situations but thrive in homes with secure, fenced yards where they can exercise. They need plenty of space and do best with active families who can provide adequate exercise and mental stimulation.\n\nWorking Roles:\nTheir intelligence and trainability make them excellent working dogs. They serve in various roles, including:\n- Police and military service\n- Search and rescue\n- Guide dogs for the visually impaired\n- Therapy dogs\n- Herding\n\nSocialization:\nEarly socialization is crucial for German Shepherds. Exposure to different people, animals, and situations helps develop well-adjusted adult dogs. Proper socialization helps prevent potential issues with aggression or fearfulness.\n\nNutrition:\nA balanced diet appropriate for their age, size, and activity level is essential. German Shepherds may require special consideration for joint health through appropriate nutrition.\n\nCommon Misconceptions:\nWhile sometimes portrayed as aggressive, well-trained and properly socialized German Shepherds are typically gentle and good-natured with their families. Their protective instincts make them naturally wary of strangers, but this shouldn't translate to aggression.\n\nChoosing a German Shepherd:\nWhen considering a German Shepherd, potential owners should:\n- Research reputable breeders or consider adoption\n- Understand the breed's exercise and training needs\n- Be prepared for regular grooming\n- Have time for training and socialization\n- Consider their living situation and lifestyle\n\nConclusion:\nGerman Shepherds are exceptional dogs that offer unwavering loyalty, intelligence, and versatility. While they require dedicated training and exercise, they reward their owners with devotion and capability in various roles, from family companion to working partner."
    }
  }
}